number,value,datetime_start,datetime_complete,duration,params_batch_size,params_ch,params_dropout,params_lr,params_wd,system_attrs_tpe:relative_params:0,state
0,0.9916002986560478,2026-10-03 07:39:15.287358,2026-10-03 07:41:28.128647,0 days 00:02:12.841289,16,deep,0.3005575058716044,0.0003574712922600243,0.0006796578090758161,,COMPLETE
1,0.9901154186544615,2026-10-03 07:41:28.166662,2026-10-03 07:43:22.306031,0 days 00:01:54.139369,16,deep,0.21597250932105788,0.00010725209743172001,1.461896279370496e-05,,COMPLETE
2,0.9901154186544615,2026-10-03 07:43:22.347530,2026-10-03 07:45:12.061254,0 days 00:01:49.713724,64,m,0.29620728443102123,0.0008012737503998541,1.5339162591163623e-06,,COMPLETE
3,0.9929436136982426,2026-10-03 07:45:12.090551,2026-10-03 07:46:55.046478,0 days 00:01:42.955927,64,s,0.34211651325607845,0.0007896186801026692,5.762487216478604e-05,,COMPLETE
4,0.984594544968123,2026-10-03 07:46:55.081729,2026-10-03 07:48:42.655610,0 days 00:01:47.573881,64,m,0.2733551396716398,0.00015144860262751404,5.4880470007660465e-06,,COMPLETE
5,0.9944825247637357,2026-10-03 07:48:42.706084,2026-10-03 07:50:31.155424,0 days 00:01:48.449340,32,m,0.022613644455269033,0.0027051668818999287,2.0013420622879995e-05,,COMPLETE
6,0.9943599267127687,2026-10-03 07:50:31.198229,2026-10-03 07:52:20.068114,0 days 00:01:48.869885,32,deep,0.03727532183988541,0.00037507963596256056,0.008862326508576254,,COMPLETE
7,0.8468694177501412,2026-10-03 07:52:20.099992,2026-10-03 07:53:23.828095,0 days 00:01:03.728103,64,l,0.1792328642721363,0.0013826083091896758,2.907208890659845e-06,,PRUNED
8,0.9293344491035347,2026-10-03 07:53:23.857151,2026-10-03 07:54:28.384044,0 days 00:01:04.526893,16,l,0.44360637128816327,0.0018832519048593583,7.742116473996259e-05,,PRUNED
9,0.9704976468374125,2026-10-03 07:54:28.413459,2026-10-03 07:55:27.044838,0 days 00:00:58.631379,32,s,0.012709563372047594,0.00015019490572374368,2.7012557725439094e-06,,PRUNED
10,0.9915727706857267,2026-10-03 07:55:27.070302,2026-10-03 07:57:14.931298,0 days 00:01:47.860996,32,m,0.21820532573099866,0.0007558361131772705,1.3188922412425568e-05,"{""batch_size"": 32, ""ch"": ""m"", ""dropout"": 0.21820532573099866, ""lr"": 0.0007558361131772705, ""wd"": 1.3188922412425568e-05}",COMPLETE
11,0.8963789929418304,2026-10-03 07:57:14.963759,2026-10-03 07:58:12.957547,0 days 00:00:57.993788,32,m,0.047798923018097475,0.002754632228644762,0.0019976918514209414,"{""batch_size"": 32, ""ch"": ""m"", ""dropout"": 0.047798923018097475, ""lr"": 0.002754632228644762, ""wd"": 0.0019976918514209414}",PRUNED
12,0.9267097465724219,2026-10-03 07:58:12.984978,2026-10-03 07:59:09.799857,0 days 00:00:56.814879,32,m,0.012536823162946369,0.0017703999849894452,1.6449802871980787e-05,"{""batch_size"": 32, ""ch"": ""m"", ""dropout"": 0.012536823162946369, ""lr"": 0.0017703999849894452, ""wd"": 1.6449802871980787e-05}",PRUNED
13,0.9957980250717837,2026-10-03 07:59:09.828580,2026-10-03 08:00:57.747914,0 days 00:01:47.919334,32,deep,0.009050667685983064,0.00042021496909178373,8.715374930558143e-06,"{""batch_size"": 32, ""ch"": ""deep"", ""dropout"": 0.009050667685983064, ""lr"": 0.00042021496909178373, ""wd"": 8.715374930558143e-06}",COMPLETE
14,0.9602171945486204,2026-10-03 08:00:57.792237,2026-10-03 08:01:56.206583,0 days 00:00:58.414346,32,deep,0.014411679586633084,0.00038378784514958483,2.6217208579755825e-06,"{""batch_size"": 32, ""ch"": ""deep"", ""dropout"": 0.014411679586633084, ""lr"": 0.00038378784514958483, ""wd"": 2.6217208579755825e-06}",PRUNED
15,0.9957710000901203,2026-10-03 08:01:56.233271,2026-10-03 08:03:47.336377,0 days 00:01:51.103106,32,deep,0.14441915061465163,0.000434370651414053,0.00020459232774141254,"{""batch_size"": 32, ""ch"": ""deep"", ""dropout"": 0.14441915061465163, ""lr"": 0.000434370651414053, ""wd"": 0.00020459232774141254}",COMPLETE
16,0.8817304005757538,2026-10-03 08:03:47.371706,2026-10-03 08:04:46.073951,0 days 00:00:58.702245,32,deep,0.08073905305343172,0.0005136113992151457,3.128535198437121e-05,"{""batch_size"": 32, ""ch"": ""deep"", ""dropout"": 0.08073905305343172, ""lr"": 0.0005136113992151457, ""wd"": 3.128535198437121e-05}",PRUNED
17,0.9701688131529487,2026-10-03 08:04:46.100953,2026-10-03 08:05:45.719527,0 days 00:00:59.618574,32,deep,0.17320306905964247,0.0026476253857338826,1.0410520490317118e-05,"{""batch_size"": 32, ""ch"": ""deep"", ""dropout"": 0.17320306905964247, ""lr"": 0.0026476253857338826, ""wd"": 1.0410520490317118e-05}",PRUNED
18,0.987297729638401,2026-10-03 08:05:45.749823,2026-10-03 08:07:28.670739,0 days 00:01:42.920916,32,deep,0.1696276670039979,0.00015080101297152261,1.7356274644852784e-06,"{""batch_size"": 32, ""ch"": ""deep"", ""dropout"": 0.1696276670039979, ""lr"": 0.00015080101297152261, ""wd"": 1.7356274644852784e-06}",PRUNED
19,0.9660072208073152,2026-10-03 08:07:28.700587,2026-10-03 08:08:27.580185,0 days 00:00:58.879598,32,deep,0.06650390623851213,0.000631848097348351,0.000406405347609878,"{""batch_size"": 32, ""ch"": ""deep"", ""dropout"": 0.06650390623851213, ""lr"": 0.000631848097348351, ""wd"": 0.000406405347609878}",PRUNED
